<?xml version="1.0" encoding="UTF-8"?>

<seqgramodel xmlns:xsi="http://www.w3.org/2001/XMLSchema-instance" xsi:noNamespaceSchemaLocation="https://kkrismer.github.io/seqgra/model-config.xsd">
	<general id="torch-mc2-dna150-conv2-gmp-fc5-s1">
		<name>1 conv layer with 2 11-nt wide filters, global max pooling, 1 fully connected layer with 5 units</name>
		<description></description>
		<task>multi-class classification</task>
		<sequencespace>DNA</sequencespace>
		<library>PyTorch</library>
		<inputencoding>1D</inputencoding>
		<labels>
			<label>c1</label>
			<label>c2</label>
		</labels>
		<seed>1</seed>
	</general>
	<architecture>
		<external format="pytorch-module" classname="TorchModel">PyTorch/o2-dna150-conv2-gmp-fc5.py</external>
	</architecture>
	<loss>
		<hyperparameter name="loss">CrossEntropyLoss</hyperparameter>
	</loss>
	<optimizer>
		<hyperparameter name="optimizer">SGD</hyperparameter>
		<hyperparameter name="learning_rate">0.001</hyperparameter>
		<hyperparameter name="momentum">0.9</hyperparameter>
	</optimizer>
	<trainingprocess>
		<hyperparameter name="batch_size">32</hyperparameter>
		<hyperparameter name="epochs">100</hyperparameter>
		<hyperparameter name="early_stopping">True</hyperparameter>
		<hyperparameter name="shuffle">True</hyperparameter>
	</trainingprocess>
</seqgramodel>
